Data;Imieniny
11-10;Andrzej, Anian, Demetriusz, Florencja, Just, Leon, Leona, Lena, Ludomir, Monitor, Nimfa, Probus, Stefan, Tryfena, Uniebog
11-11;Anastazja, Bartłomiej, Marcin oraz Alicja, Maciej, Martin, Jozafat, Menas, Pafnucy, Prot, Sobieżyr, Spycisław
11-12;Arsacjusz, Aureliusz, Cibor, Czcibor, Emilian, Gabriel, Jan, Jonasz, Jozafat, Kunibert, Nila, Nilus, Publiusz, Renat, Renata, Witold, Witolda
11-13;Daniel, Faust, Florencjusz, Florenty, Gerald, Geraldyna, Gerbert, Honorat, January, Karp, Magdalena, Marcjalis, Maurycy, Mikołaj, Reginbald, Siemisław, Teofil, Wacław, Wacława, Wenancjusz, Wenanty
11-14;Agata, Agryppa, Antyd, Damian, Elżbieta, Hipacy, Józef, Judyta, Klementyn, Kosma, Laurenty, Lewin, Serafin, Ścibor, Wszerad
11-15;Albert, Alfons, Artur, Gurias, Idalia, Józef, Leopold, Leopoldyna, Przybygniew, Roger, Sekundus
11-16;Agnieszka, Audomar, Ariel, Aureliusz, Dionizy, Edmund, Eucheriusz, Gertruda, Łucja, Małgorzata, Niedamir, Otmar, Patrokles
11-17;Alfeusz, Arabella, Dionizy, Drogomir, Drogoradz, Elżbieta, Floryn, Grzegorz, Hugo, Hugon, Jan, Jozafat, Roch, Salomea, Sulibor, Wiktoria, Zacheusz, Zbysław
11-18;Agnieszka, Aniela, Cieszymysł, Filipina, Gabriela, Galezy, Hezychiusz, Józefa, Karolina, Klaudyna, Leonard, Noe, Odo, Odon, Roman, Tomasz
11-19;Barlaam, Barbara, Dionizy, Dargosław, Elżbieta, Faust, Jakub, Kryspin, Maksym, Małowid, Matylda, Paweł, Salomea, Seweryn, Teodor
11-20;Agapiusz, Ampelia, Ampeliusz, Edmund, Eustachy, Feliks, Fortunata, Grzegorz, Lubomir, Maksencja, Maria, Narzes, Oktawia, Oktawiusz, Rafał, Sędzimir, Sylwester, Sylwestra, Symplicjusz, Symplicy, Tespezjusz, Tespezy
11-21;Albert, Elwira, Gelazja, Gelazy, Heliodor, Janusz, Kadok, Kolumban, Konrad, Maria, Regina, Rufus, Twardosław, Wiesław
11-22;Cecylia, Ernestyna, Filemon, Filemona, Marek, Maur, Salwator, Stefan, Wszemił, Wszemiła
11-23;Amfiloch, Felicyta, Fotyna, Grzegorz, Klemens, Lukrecja, Michał, Orestes, Przedwoj, Syzyniusz
11-24;Biruta, Dobrosław, Ema, Emilia, Emma, Flora, Franciszek, Gerard, Gerarda, Jan, Pęcisław, Protazy
11-25;Beatrycze, Elżbieta, Erazm, Godzimir, Józef, Katarzyna, Maria, Merkury, Mojżesz, Piotr, Tęgomir
11-26;Delfin, Dobiemiest, Jan, Konrad, Lechosław, Lechosława, Leonard, Leonarda, Sylwester
11-27;Achacjusz, Achacy, Astryda, Bernardyn, Damazy, Dominik, Franciszek, Gustaw, Gustawa, Irenarch, Jakub, Jarosław, Jozafat, Maksym, Małgorzata, Oda, Prymityw, Radosław, Stojgniew, Walerian, Walery, Wergilia, Wergiliusz, Wirgilia, Wirgiliusz, Zygfryd, Zygfryda, Żaneta
11-28;Berta, Eustachy, Feliks, Ginter, Gościrad, Grzegorz, Guncerz, Gunter, Jakub, Krescencjusz, Krescens, Kwieta, Lesław, Lesława, Manswet, Radowit, Rufus, Sostenes, Stefan, Teodora, Tristan, Urban, Walerian, Zdziesław, Zdzisław
11-29;Błażej, Błażeja, Bolemysł, Dionizy, Filomen, Franciszek, Fryderyk, Klementyna, Pafnucy, Paramon, Przemysł, Radbod, Saturnin, Siedlewit, Syzyniusz, Walter
11-30;Andrzej, Fryderyk, Justyna, Konstancjusz, Kutbert, Maura, Tadea, Zbysława, Zozym
12-01;Aleksander, Ananiasz, Antoni, Blanka, Długomił, Edmund, Eligia, Eligiusz, Ewazjusz, Florencja, Godzisław, Gosław, Gosława, Jan, Natalia, Prokul, Projektus, Rudolf, Rudolfa, Rudolfina, Sobiesław, Sobiesława
12-02;Aurelia, Balbina, Bibiana, Bibianna, Budzisław, Budzisława, Budzsław, Jan, Ludwina, Maria, Paulina, Rafał, Sulisław, Sylwan, Sylweriusz, Sylwery, Walenty, Walentyn, Wiktoryn, Zbylut
12-03;Atalia, Biryn, Ema, Emma, Franciszek, Franciszek Ksawery, Gerlinda, Hilaria, Kasjan, Kryspin, Ksawery, Lucjusz, Łucjusz, Mirokles, Sofoniasz, Uniemir
12-04;Barbara, Benon, Bernard, Bratomiła, Bratumiła, Chrystian, Ciechosław, Ciechosława, Cieszybor, Feliks, Filip, Hieronim, Jan, Klemens, Krystian, Marut, Maruta, Marutas, Melecjusz, Osmund, Teofan
12-05;Anastazy, Bartosz, Bartłomiej, Dalmacjusz, Feliks, Gerald, Geraldyna, Jan, Juliusz, Kryspin, Kryspina, Krystyna, Mikołaj, Pelin, Pelina, Pęcisława, Sabbas
12-06;Abraham, Angelika, Bonifacy, Dionizja, Emilian, Heliodor, Leoncja, Mikołaj, Morzysława, Piotr, Polichroniusz, Nikola, Tercjusz
12-07;Agaton, Ambrozja, Ambroży, Atenodor, Eutychian, Józefa, Marcin, Marcisław, Ninomysł, Polikarp, Sabin, Siemirad, Urban, Zdziemił
12-08;Alojzy, Apollo, Boguwola, Edyta, Elfryda, Euchariusz, Euchary, Hildemar, Makary, Maria, Narcyza, Patapiusz, Potapiusz, Romaryk, Świedarg
12-09;Chwalimira, Delfina, Gorgonia, Jan, Leokadia, Liboriusz, Naczęmir, Piotr, Prokul, Waleria, Wielisława, Wiesław, Wiesława, Wrocisław
12-10;Bogdał, Bogdan, Bogodał, Brajan, Daniel, Donat, Eulalia, Grzegorz, Hermogenes, Judyta, Julia, Loreta, Maria, Maur, Melchiades, Menas, Nikoleta, Polidor, Switun, Unierad, Unirad
12-11;Artur, Damazy, Daniel, Gościwit, Hieronim, Maria, Poncjan, Sabin, Stefan, Waldemar, Walenty, Walentyn, Wilburga, Wojmir
12-12;Adelajda, Aleksander, Amonaria, Bartosz, Dionizja, Edburga, Epimach, Franciszka, Gościwit, Justyn, Konrad, Konrada, Konstancjusz, Liberata, Maksanty, Maksencjusz, Merkuria, Paramon, Przybysława, Spirydion, Spirydon, Suliwuj, Synezjusz
12-13;Antioch, Antoni, Aubert, Auksencja, Auksencjusz, Auksenty, Edburga, Eugeniusz, Jodok, Łucja, Orestes, Otylia, Róża, Samboja, Walenty, Walentyn
12-14;Agnellus, Arseniusz, Bertold, Druzus, Eutropia, Gorzysław, Heron, Izydor, Jan, Nahum, Nikazjusz, Nikazy, Noemi, Pompejusz, Sławobor, Teodor, Wenancjusz, Wenanty, Wiator, Zozym
12-15;Antoni, Bachus, Bakchus, Drogosław, Drogosława, Euzebiusz, Ireneusz, Jan, Maksymin, Maksymina, Maria, Maryn, Maryniusz, Mścigniew, Mścigniewa, Nina, Saturnin, Teodor, Walerian, Weronika, Wiktor, Wolimir
12-16;Agrykola, Ananiasz, Adelajda, Albina, Alina, Deder, Dyter, Euzebiusz, Konkordiusz, Maria, Sebastian, Tyter, Walenty, Walentyn, Wolisław, Wolisława, Zdzisław, Zdzisława
12-17;Bega, Florian, Jan, Łazarz, Łukasz, Modest, Wiwina, Żerosław, Żyrosław
12-18;Auksencja, Auksencjusz, Auksenty, Bogusław, Flawit, Gościmiar, Kwintus, Miłosław, Nemezja, Rufus, Symplicjusz, Winebald, Winibald, Winibalda, Wszemir, Wunibald, Zofia, Zozym
12-19;Abraham, Anastazy, Beniamin, Bogumiła, Dariusz, Eleonora, Grzegorz, Kazimiera, Mścigniew, Nemezjusz, Nemezy, Protazja, Tymoteusz, Urban
12-20;Amon, Bogumił, Bogumiła, Dagmara, Dagna, Dominik, Eugeniusz, Krystian, Liberat, Makary, Ptolemeusz, Teofil, Ursycyn, Wincenty, Zefiryn, Zenon
12-21;Anastazy, Balbin, Festus, Gliceriusz, Glicery, Honorat, Piotr, Temistokles, Tomasz, Tomisław, Tomisława
12-22;Beata, Dobrosułka, Drogomir, Dziesława, Dziwisław, Flawian, Franciszka, Franciszka Ksawera, Gryzelda, Honorata, Ischyrion, Judyta, Ksawera, Luboradz, Zenon, Zenona
12-23;Anatola, Anatolia, Bazylides, Dagobert, Ewaryst, Ewarysta, Gelazy, Iwo, Iwona, Mardoniusz, Saturnin, Serwul, Sławomir, Sławomira, Teodul, Torlak, Wiktoria
12-24;Ada, Adam, Adamina, Adela, Delfin, Druzjan, Druzjanna, Eryk, Eryka, Ewa, Ewelina, Godzisław, Godzisława, Grzegorz, Grzymisława, Hermana, Hermina, Herminia, Irma, Irmina, Józef, Paula, Tarsylia, Zenobiusz
12-25;Anastazja, Eugenia, Maria, Mateusz, Piotr, Siemosław
12-26;Dionizy, Szczepan, Teodor, Wincencja, Wincenta, Wincentyna, Wrociwoj, Zenon, Zozym
12-27;Bartłomiej, Cezary, Fabiola, Gosław, Jan, Krystyna, Maksym, Mateusz, Przybyrad, Przybysław, Sara, Teodor, Teofan, Żaneta
12-28;Antoni, Armin, Cezary, Dobrowieść, Domna, Domniusz, Emma, Godzisław, Teofila, Teona, Teonas, Troadiusz
12-29;Dawid, Domaradz, Dominik, Ebrulf, Ekhard, Gerard, Gerarda, Gosław, Honorat, Jonatan, Krescencjusz, Krescens, Krescenty, Marceli, Marcin, Prymian, Radowit, Saturnin, Tadea, Tomasz, Trofim, Wiktor
12-30;Anizja, Anizjusz, Dionizy, Egwin, Eksuperancjusz, Eugeniusz, Liberiusz, Łazarz, Małgorzata, Marceli, Perpet, Rajner, Sewer, Uniedrog
12-31;Barbacjan, Donata, Katarzyna, Kolumba, Mariusz, Melania, Paulina, Saturnina, Sebastian, Sylwester, Sylwestra, Tworzysław, Zotyk
